{
  "correlation_id": "corr_partnerprogram_commercial_usage_record",
  "entry": {
    "entry_id": "usage_ledger_000001",
    "partner_id": "ops-admin",
    "feature_code": "vault_reconciliation_export",
    "unit_type": "export_count",
    "units": 2,
    "unit_price_usd_micros": 500000,
    "amount_usd_micros": 1000000,
    "occurred_at": "2026-02-20T00:00:00.000Z",
    "metadata": {
      "cycle_id": "cycle_m76"
    }
  },
  "ledger_summary": {
    "partner_id": "ops-admin",
    "entries_count": 1,
    "total_units": 2,
    "total_amount_usd_micros": 1000000,
    "feature_breakdown": [
      {
        "feature_code": "vault_reconciliation_export",
        "unit_type": "export_count",
        "units": 2,
        "amount_usd_micros": 1000000
      }
    ]
  },
  "replayed": false
}
